<?xml version="1.0"?>

<xsd:schema xmlns:xsd="http://www.w3.org/2001/XMLSchema">

  <xsd:annotation>
    <xsd:documentation xml:lang="en">
      Chief Architect user shortcut key configuration.
    </xsd:documentation>
  </xsd:annotation>

  <xsd:element name="UserHotkeys" type="UserHotkeysType"/>

  <xsd:complexType name="UserHotkeysType">
    <xsd:sequence>
      <xsd:element name="product" type="productType"/>
      <xsd:element name="command" type="commandType" maxOccurs="unbounded"/>
    </xsd:sequence>
  </xsd:complexType>

  <xsd:complexType name="productType">
    <xsd:sequence>
      <xsd:element name="name" type="xsd:token"/>
      <xsd:element name="productVersion" type="xsd:token">
	<!--<xsd:pattern value="[0-9]+(.[0-9]+){3}"/>-->
      </xsd:element>
      <xsd:element name="fileVersion" type="xsd:int"/>
    </xsd:sequence>
  </xsd:complexType>

  <xsd:complexType name="commandType">
    <xsd:sequence>
      <xsd:element name="id" type="xsd:int"/>
      <xsd:element name="keyCodes" type="xsd:token">
	<!--<xsd:pattern value="([0-7]\+[0-9]{1-3};)+"/>-->
      </xsd:element>
    </xsd:sequence>
  </xsd:complexType>

</xsd:schema>
